{
  "document_id": "PDF_002",
  "document_type": "capital_call",
  "document_filename": "PDF_002_SeedSpring_SEA_VC_I_Capital_Call_Exception.pdf",
  "extraction_mode": "baseline",
  "source_path": "/Users/yana/Documents/GitHub/project_portfolio_dashboard/data/raw/family_office_corrected_dataset_v1/documents/PDF_002_SeedSpring_SEA_VC_I_Capital_Call_Exception.pdf",
  "fund_name_raw": "SeedSpring SEA VC I",
  "fund_name_mapped": "SeedSpring Southeast Asia VC Fund I",
  "investor_entity": "Atlas Investment Partners USD Ltd.",
  "notice_date": "2026-05-17",
  "reporting_period": "May 2026 event",
  "currency": "USD",
  "extracted_fields": {
    "due_date": "2026-05-22",
    "amount_due": 2.75,
    "total_commitment": null,
    "paid_in_capital": null,
    "unfunded_commitment": null,
    "management_fee": 0.2,
    "partnership_expense": 0.05,
    "investment_call": 2.5,
    "urgent_due_date_flag": true,
    "missing_required_field_flag": true,
    "bank_instruction_changed_flag": false,
    "transaction_components": [
      {
        "component_type": "investment_call",
        "amount": 2.5,
        "currency": "USD"
      },
      {
        "component_type": "management_fee",
        "amount": 0.2,
        "currency": "USD"
      },
      {
        "component_type": "partnership_expense",
        "amount": 0.05,
        "currency": "USD"
      }
    ]
  },
  "source_references": [
    {
      "page": 1,
      "field_name": "due_date",
      "evidence_text": "2026-05-22"
    },
    {
      "page": 1,
      "field_name": "amount_due",
      "evidence_text": "USD 2.75 million"
    },
    {
      "page": 1,
      "field_name": "investment_call",
      "evidence_text": "USD 2.50 million"
    },
    {
      "page": 1,
      "field_name": "management_fee",
      "evidence_text": "USD 0.20 million"
    },
    {
      "page": 1,
      "field_name": "partnership_expense",
      "evidence_text": "USD 0.05 million"
    },
    {
      "page": 1,
      "field_name": "unfunded_commitment",
      "evidence_text": "Not stated in notice"
    }
  ],
  "confidence_score": 0.85,
  "extraction_status": "partial",
  "validation_status": "pending",
  "review_status": "pending",
  "warnings": [
    "Missing required extracted fields: unfunded_commitment"
  ]
}